{
  "$schema": "https://diskcutter.app/catalog.schema.json",
  "schema_version": 1,
  "generated_at": "2026-05-13T07:00:00Z",
  "source_commit": "bundled",
  "groups": [
    {
      "id": "linux-desktop",
      "name": "Linux desktop",
      "description": "General-purpose Linux distributions with a graphical desktop. Pick one of these for a normal personal computer.",
      "images": [
        {
          "id": "ubuntu-24-04-desktop",
          "name": "Ubuntu 24.04 LTS Desktop",
          "description": "Most popular general-purpose Linux desktop. 5-year support window.",
          "download_url": "https://releases.ubuntu.com/24.04/ubuntu-24.04.1-desktop-amd64.iso",
          "sha256sums_url": "https://releases.ubuntu.com/24.04/SHA256SUMS",
          "homepage": "https://ubuntu.com/download/desktop",
          "size_bytes": 5826609152,
          "published_at": "2024-08-29",
          "arch": "x86_64"
        },
        {
          "id": "fedora-40-workstation",
          "name": "Fedora 40 Workstation",
          "description": "Cutting-edge desktop distribution. GNOME by default.",
          "download_url": "https://download.fedoraproject.org/pub/fedora/linux/releases/40/Workstation/x86_64/iso/Fedora-Workstation-Live-x86_64-40-1.14.iso",
          "sha256sums_url": "https://download.fedoraproject.org/pub/fedora/linux/releases/40/Workstation/x86_64/iso/Fedora-Workstation-40-1.14-x86_64-CHECKSUM",
          "homepage": "https://fedoraproject.org/workstation/",
          "size_bytes": 2370146304,
          "published_at": "2024-04-23",
          "arch": "x86_64"
        },
        {
          "id": "linux-mint-22-cinnamon",
          "name": "Linux Mint 22 Cinnamon",
          "description": "Friendly Ubuntu-based desktop. Cinnamon environment.",
          "download_url": "https://mirrors.edge.kernel.org/linuxmint/stable/22/linuxmint-22-cinnamon-64bit.iso",
          "sha256sums_url": "https://mirrors.edge.kernel.org/linuxmint/stable/22/sha256sum.txt",
          "homepage": "https://linuxmint.com/edition.php?id=313",
          "size_bytes": 2902820864,
          "published_at": "2024-07-25",
          "arch": "x86_64"
        }
      ]
    },
    {
      "id": "linux-server",
      "name": "Linux server",
      "description": "Headless Linux installs. No graphical desktop.",
      "images": [
        {
          "id": "ubuntu-24-04-server",
          "name": "Ubuntu 24.04 LTS Server",
          "description": "Headless server install. 5-year support window.",
          "download_url": "https://releases.ubuntu.com/24.04/ubuntu-24.04.1-live-server-amd64.iso",
          "sha256sums_url": "https://releases.ubuntu.com/24.04/SHA256SUMS",
          "homepage": "https://ubuntu.com/download/server",
          "size_bytes": 2785017856,
          "published_at": "2024-08-29",
          "arch": "x86_64"
        },
        {
          "id": "debian-12-netinst",
          "name": "Debian 12 (Bookworm) netinst",
          "description": "Minimal Debian netinstall — fetches packages from a mirror at install time.",
          "download_url": "https://cdimage.debian.org/debian-cd/current/amd64/iso-cd/debian-12.7.0-amd64-netinst.iso",
          "sha256sums_url": "https://cdimage.debian.org/debian-cd/current/amd64/iso-cd/SHA256SUMS",
          "homepage": "https://www.debian.org/download",
          "size_bytes": 661651456,
          "published_at": "2024-08-31",
          "arch": "x86_64"
        }
      ]
    },
    {
      "id": "embedded",
      "name": "Embedded / SBC",
      "description": "Images for single-board computers and embedded devices.",
      "images": [
        {
          "id": "raspberry-pi-os-lite",
          "name": "Raspberry Pi OS (Lite, 64-bit)",
          "description": "Headless Raspberry Pi OS. SD-card image. Tracks the latest stable release.",
          "download_url": "https://downloads.raspberrypi.com/raspios_lite_arm64_latest",
          "sha256sums_url": "",
          "homepage": "https://www.raspberrypi.com/software/operating-systems/",
          "size_bytes": null,
          "published_at": null,
          "arch": "aarch64"
        }
      ]
    },
    {
      "id": "privacy",
      "name": "Privacy & anonymity",
      "description": "Live operating systems focused on leaving no trace.",
      "images": [
        {
          "id": "tails-6",
          "name": "Tails 6",
          "description": "Privacy-focused live OS — runs from USB, leaves no trace on the host.",
          "download_url": "https://download.tails.net/tails/stable/tails-amd64-6.10/tails-amd64-6.10.iso",
          "sha256sums_url": "",
          "homepage": "https://tails.net/install/",
          "size_bytes": 1379000000,
          "published_at": "2024-10-08",
          "arch": "x86_64"
        }
      ]
    },
    {
      "id": "bsd",
      "name": "BSD",
      "description": "Berkeley-derived Unix systems. Different lineage to Linux.",
      "images": [
        {
          "id": "freebsd-14",
          "name": "FreeBSD 14 (memstick)",
          "description": "BSD Unix derivative. Ports tree, ZFS-first storage.",
          "download_url": "https://download.freebsd.org/releases/amd64/amd64/ISO-IMAGES/14.1/FreeBSD-14.1-RELEASE-amd64-memstick.img",
          "sha256sums_url": "https://download.freebsd.org/releases/amd64/amd64/ISO-IMAGES/14.1/CHECKSUM.SHA256-FreeBSD-14.1-RELEASE-amd64",
          "homepage": "https://www.freebsd.org/where/",
          "size_bytes": 1336932352,
          "published_at": "2024-06-04",
          "arch": "x86_64"
        }
      ]
    },
    {
      "id": "rescue",
      "name": "Rescue & forensics",
      "description": "Live toolkits for repairing systems and recovering data.",
      "images": [
        {
          "id": "systemrescue",
          "name": "SystemRescue 11.02",
          "description": "Live rescue toolkit — gparted, testdisk, photorec, ddrescue.",
          "download_url": "https://fastly-cdn.system-rescue.org/releases/11.02/systemrescue-11.02-amd64.iso",
          "sha256sums_url": "https://fastly-cdn.system-rescue.org/releases/11.02/sha256sum.txt",
          "homepage": "https://www.system-rescue.org/Download/",
          "size_bytes": 832094208,
          "published_at": "2024-09-27",
          "arch": "x86_64"
        }
      ]
    }
  ]
}
